### ISSUE TITLE
Not connecting to Slaves

### ISSUE THREAD

**Issue by papafil** [kudelskisecurity/scannerl#2]
Hi there,

I am trying your tool. First, thanks for the project. 
I got a trouble setting up my mignons. Here are the info:

```
$ uname -a
Linux x86_64 #1 SMP Tue Oct 17 23:58:50 UTC 2017 x86_64 x86_64 x86_64 GNU/Linux`
cat /etc/issue
Ubuntu 16.04.3 LTS \n \l
```

> sudo ./scannerl -v 255 -m httpbg -d google.com -s localhost
>    ____   ____    _    _   _ _   _ _____ ____  _
>   / ___| / ___|  / \  | \ | | \ | | ____|  _ \| |
>   \___ \| |     / _ \ |  \| |  \| |  _| | |_) | |
>    ___) | |___ / ___ \| |\  | |\  | |___|  _ <| |___
>   |____/ \____/_/   \_\_| \_|_| \_|_____|_| \_\_____| v0.37 (4e14fa5)
>                                                    
> compiled with erlang 18 (using genfsm)
> [DBG] [20180205151904] [scannerl] level-1   (fpmodules):    true
> [DBG] [20180205151904] [scannerl] level-2   (outmodules):   true
> [DBG] [20180205151904] [scannerl] level-4   (broker):       true
> [DBG] [20180205151904] [scannerl] level-8   (master):       true
> [DBG] [20180205151904] [scannerl] level-16  (scannerl):     true
> [DBG] [20180205151904] [scannerl] level-32  (?):            true
> [DBG] [20180205151904] [scannerl] level-64  (?):            true
> [DBG] [20180205151904] [scannerl] level-128 (additional):   true
> [DBG] [20180205151904] [scannerl] [ql:0] 
> [DBG] [20180205151904] [scannerl] [ql:0] -------------------------------------
> [DBG] [20180205151904] [scannerl] [ql:0] Module:      fp_httpbg
> [DBG] [20180205151904] [scannerl] [ql:0] Modarg:      []
> [DBG] [20180205151904] [scannerl] [ql:0] Target:      []
> [DBG] [20180205151904] [scannerl] [ql:0] Target-file: nil
> [DBG] [20180205151904] [scannerl] [ql:0] Domain:      ["google.com"]
> [DBG] [20180205151904] [scannerl] [ql:0] Domain-file: nil
> [DBG] [20180205151904] [scannerl] [ql:0] Slave:       ["localhost"]
> [DBG] [20180205151904] [scannerl] [ql:0] Slave-file:  nil
> [DBG] [20180205151904] [scannerl] [ql:0] Port:        80
> [DBG] [20180205151904] [scannerl] [ql:0] Timeout:     3000
> [DBG] [20180205151904] [scannerl] [ql:0] Maxpkt:      1
> [DBG] [20180205151904] [scannerl] [ql:0] Retry:       0
> [DBG] [20180205151904] [scannerl] [ql:0] Outmode:     0
> [DBG] [20180205151904] [scannerl] [ql:0] Out:         [{out_stdout,[]}]
> [DBG] [20180205151904] [scannerl] [ql:0] Max proc:    28232
> [DBG] [20180205151904] [scannerl] [ql:0] Minrange:    24
> [DBG] [20180205151904] [scannerl] [ql:0] Dry:         false
> [DBG] [20180205151904] [scannerl] [ql:0] Nosafe:      false
> [DBG] [20180205151904] [scannerl] [ql:0] Privports:   false
> [DBG] [20180205151904] [scannerl] [ql:0] Sockopt:     []
> [DBG] [20180205151904] [scannerl] [ql:0] Debug:       255
> [DBG] [20180205151904] [scannerl] [ql:0] Config file: nil
> [DBG] [20180205151904] [scannerl] [ql:0] -------------------------------------
> [DBG] [20180205151904] [scannerl] [ql:0] 
> starting master ...
> [DBG] [20180205151904] [scannerl] [ql:0] (pause:false) result received: 0 | queuelen: 0
> <20180205151904> [M]     20180205151904
> <20180205151904> [M]     SCANNERL started for Module fp_httpbg
> <20180205151904> [M]     starting 1 slave's node(s) on 1 host(s)
> <20180205151904> [M]     max process per node: 28232
> [DBG] [20180205151904] [master] [ql:0] [uslave] connecting to "'1517840344-slave-0@localhost'"
> [DBG] [20180205151904] [master] [ql:0] [uslave] ping '1517840344-slave-0@localhost' failed
> [DBG] [20180205151904] [master] [ql:0] [uslave] starting "'1517840344-slave-0@localhost'" on "localhost"
> [DBG] [20180205151904] [master] [ql:0] [uslave] remote command: "ssh -q -o UserKnownHostsFile=/dev/null -o StrictHostKeyChecking=no localhost erl -sname 1517840344-slave-0 -hidden +K true -smp enable -P 134217727 -connect_all false -kernel dist_nodelay false -kernel inet_dist_listen_min 11100 -detached -noinput"
> [DBG] [20180205151904] [master] [ql:0] [uslave] ping '1517840344-slave-0@localhost' failed
> [DBG] [20180205151905] [master] [ql:0] [uslave] ping '1517840344-slave-0@localhost' failed
> [DBG] [20180205151905] [master] [ql:0] [uslave] ping '1517840344-slave-0@localhost' failed
> [DBG] [20180205151906] [master] [ql:0] [uslave] ping '1517840344-slave-0@localhost' failed
> [DBG] [20180205151906] [master] [ql:0] [uslave] ping '1517840344-slave-0@localhost' failed
> [DBG] [20180205151907] [master] [ql:0] [uslave] ping '1517840344-slave-0@localhost' failed
> [DBG] [20180205151907] [master] [ql:0] [uslave] ping '1517840344-slave-0@localhost' failed
> [DBG] [20180205151908] [master] [ql:0] [uslave] ping '1517840344-slave-0@localhost' failed
> [DBG] [20180205151908] [master] [ql:0] [uslave] ping '1517840344-slave-0@localhost' failed
> [DBG] [20180205151909] [master] [ql:0] [uslave] ping '1517840344-slave-0@localhost' failed
> [DBG] [20180205151909] [master] [ql:0] [uslave] ping '1517840344-slave-0@localhost' failed
> [DBG] [20180205151910] [master] [ql:0] [uslave] ping '1517840344-slave-0@localhost' failed
> [DBG] [20180205151910] [master] [ql:0] [uslave] ping '1517840344-slave-0@localhost' failed
> [DBG] [20180205151911] [master] [ql:0] [uslave] ping '1517840344-slave-0@localhost' failed
> [DBG] [20180205151911] [master] [ql:0] [uslave] ping '1517840344-slave-0@localhost' failed
> [DBG] [20180205151912] [master] [ql:0] [uslave] ping '1517840344-slave-0@localhost' failed
> [DBG] [20180205151912] [master] [ql:0] [uslave] ping '1517840344-slave-0@localhost' failed
> [DBG] [20180205151913] [master] [ql:0] [uslave] ping '1517840344-slave-0@localhost' failed
> [DBG] [20180205151913] [master] [ql:0] [uslave] ping '1517840344-slave-0@localhost' failed
> [DBG] [20180205151914] [master] [ql:0] [uslave] connection timed-out after 10s
> <20180205151914> [M]>[E] unable to start host "localhost" (name:"1517840344-slave-0"): timeout
> <20180205151914> [M]     slave's node(s) started in: 00:00:10
> <20180205151914> [M]>[E] slave's node(s) start failed
> [DBG] [20180205151914] [master] [ql:0] [uslave] halting ""localhost""
> <20180205151914> [M]     duration: 00:00:10
> Failed
> {"init terminating in do_boot",{{function_clause,[{gen,do_for_proc,[{rex,"localhost"},#Fun<gen.0.132519590>],[{file,"gen.erl"},{line,252}]},{gen_server,call,3,[{file,"gen_server.erl"},{line,208}]},{rpc,do_call,3,[{file,"rpc.erl"},{line,336}]},{utils_slave,stop,2,[{file,"src/utils/utils_slave.erl"},{line,62}]}]},{gen_server,call,[{rex,"localhost"},{call,erlang,halt,[],<0.24.0>},infinity]}}}
> User defined signal 2
> 

SSH is working correctly locally and also,while working, netstat shows that the ports 11000 and 4369 are open (and reachable)

```
 sudo netstat -laputen | grep -E "epm|beam"
tcp        0      0 0.0.0.0:4369            0.0.0.0:*               LISTEN      1000       625522      24396/epmd      
tcp        0      0 0.0.0.0:11100           0.0.0.0:*               LISTEN      1000       626332      24398/beam.smp  
tcp        0      0 0.0.0.0:44173           0.0.0.0:*               LISTEN      0          640493      27048/beam.smp  
tcp        0      0 127.0.0.1:46843         127.0.0.1:4369          ESTABLISHED 0          640495      27048/beam.smp  
tcp        0      0 127.0.0.1:4369          127.0.0.1:46843         ESTABLISHED 1000       641305      24396/epmd      
tcp        0      0 127.0.0.1:43767         127.0.0.1:4369          ESTABLISHED 1000       626334      24398/beam.smp  
tcp        0      0 127.0.0.1:4369          127.0.0.1:43767         ESTABLISHED 1000       625532      24396/epmd      
tcp6       0      0 :::4369                 :::*                    LISTEN      1000       625523      24396/epmd   

```

The erl crash_dump:

```
=erl_crash_dump:0.3
Mon Feb  5 14:17:04 2018
Slogan: Kernel pid terminated (application_controller) ({application_start_failure,kernel,{{shutdown,{failed_to_start_child,net_sup,{shutdown,{failed_to_start_c
hild,net_kernel,{'EXIT',nodistribution}}}}},{k
System version: Erlang/OTP 18 [erts-7.3] [source] [64-bit] [smp:2:2] [async-threads:10] [kernel-poll:true]
Compiled: Fri Apr  8 10:11:48 2016
Taints: 
Atoms: 5547
Calling Thread: scheduler:2
=scheduler:1
Scheduler Sleep Info Flags: SLEEPING | TSE_SLEEPING | WAITING
Scheduler Sleep Info Aux Work: 
Current Port: 
Run Queue Max Length: 0
Run Queue High Length: 0
Run Queue Normal Length: 0
Run Queue Low Length: 0
Run Queue Port Length: 0
Run Queue Flags: OUT_OF_WORK | HALFTIME_OUT_OF_WORK
Current Process: 
=scheduler:2
Scheduler Sleep Info Flags: 
Scheduler Sleep Info Aux Work: DELAYED_AW_WAKEUP | THR_PRGR_LATER_OP
Current Port: 
Run Queue Max Length: 0
Run Queue High Length: 0
Run Queue Normal Length: 0
Run Queue Low Length: 0
Run Queue Port Length: 0
Run Queue Flags: OUT_OF_WORK | HALFTIME_OUT_OF_WORK | NONEMPTY | UNKNOWN(134217728)
Current Process: <0.0.0>
Current Process State: Running
Current Process Internal State: ACT_PRIO_NORMAL | USR_PRIO_NORMAL | PRQ_PRIO_NORMAL | ACTIVE | RUNNING | TRAP_EXIT
Current Process Program counter: 0x0000749492fedba0 (init:sleep/1 + 64)
Current Process CP: 0x0000000000000000 (invalid)
Current Process Limited Stack Trace:
0x000074949018e490:SReturn addr 0x92FEA0C8 (init:boot_loop/2 + 3688)
0x000074949018e498:SReturn addr 0x894628 (<terminate process normally>)
=memory

```

And finally, tcpdump sees some stuff

```
sudo tcpdump -i lo
15:34:46.204762 IP localhost.55035 > localhost.epmd: Flags [S], seq 1094014743, win 43690, options [mss 65495,nop,nop,sackOK,nop,wscale 6], length 0
15:34:46.204774 IP localhost.epmd > localhost.55035: Flags [S.], seq 2177514764, ack 1094014744, win 43690, options [mss 65495,nop,nop,sackOK,nop,wscale 6], length 0
15:34:46.204784 IP localhost.55035 > localhost.epmd: Flags [.], ack 1, win 683, length 0
15:34:46.204823 IP localhost.55035 > localhost.epmd: Flags [P.], seq 1:32, ack 1, win 683, length 31
15:34:46.205088 IP localhost.epmd > localhost.55035: Flags [P.], seq 1:5, ack 32, win 683, length 4
15:34:46.205095 IP localhost.55035 > localhost.epmd: Flags [.], ack 5, win 683, length 0
15:34:46.226889 IP localhost.42537 > localhost.epmd: Flags [S], seq 442684808, win 43690, options [mss 65495,nop,nop,sackOK,nop,wscale 6], length 0
15:34:46.226910 IP localhost.epmd > localhost.42537: Flags [S.], seq 391235768, ack 442684809, win 43690, options [mss 65495,nop,nop,sackOK,nop,wscale 6], length 0
15:34:46.226924 IP localhost.42537 > localhost.epmd: Flags [.], ack 1, win 683, length 0
15:34:46.227155 IP localhost.42537 > localhost.epmd: Flags [P.], seq 1:22, ack 1, win 683, length 21
15:34:46.227161 IP localhost.epmd > localhost.42537: Flags [.], ack 22, win 683, length 0
15:34:46.227206 IP localhost.epmd > localhost.42537: Flags [P.], seq 1:3, ack 22, win 683, length 2
15:34:46.227217 IP localhost.epmd > localhost.42537: Flags [F.], seq 3, ack 22, win 683, length 0
15:34:46.227268 IP localhost.42537 > localhost.epmd: Flags [.], ack 3, win 683, length 0
15:34:46.227330 IP localhost.42537 > localhost.epmd: Flags [F.], seq 22, ack 4, win 683, length 0
15:34:46.227343 IP localhost.epmd > localhost.42537: Flags [.], ack 23, win 683, length 0
15:34:46.233765 IP localhost.58638 > localhost.ssh: Flags [S], seq 1582356422, win 43690, options [mss 65495,nop,nop,sackOK,nop,wscale 6], length 0
15:34:46.233777 IP localhost.ssh > localhost.58638: Flags [S.], seq 1059660220, ack 1582356423, win 43690, options [mss 65495,nop,nop,sackOK,nop,wscale 6], length 0
15:34:46.233786 IP localhost.58638 > localhost.ssh: Flags [.], ack 1, win 683, length 0
15:34:46.234591 IP localhost.58638 > localhost.ssh: Flags [P.], seq 1:42, ack 1, win 683, length 41
15:34:46.234609 IP localhost.ssh > localhost.58638: Flags [.], ack 42, win 683, length 0
15:34:46.241170 IP localhost.ssh > localhost.58638: Flags [P.], seq 1:42, ack 42, win 683, length 41
15:34:46.241305 IP localhost.58638 > localhost.ssh: Flags [.], ack 42, win 683, length 0
15:34:46.241527 IP localhost.58638 > localhost.ssh: Flags [P.], seq 42:1378, ack 42, win 683, length 1336
15:34:46.242127 IP localhost.ssh > localhost.58638: Flags [P.], seq 42:1018, ack 1378, win 2730, length 976
15:34:46.244007 IP localhost.58638 > localhost.ssh: Flags [P.], seq 1378:1426, ack 1018, win 714, length 48
15:34:46.248015 IP localhost.ssh > localhost.58638: Flags [P.], seq 1018:1382, ack 1426, win 2730, length 364
15:34:46.250197 IP localhost.58638 > localhost.ssh: Flags [P.], seq 1426:1442, ack 1382, win 744, length 16
15:34:46.290672 IP localhost.ssh > localhost.58638: Flags [.], ack 1442, win 2730, length 0
15:34:46.290706 IP localhost.58638 > localhost.ssh: Flags [P.], seq 1442:1486, ack 1382, win 744, length 44
15:34:46.290719 IP localhost.ssh > localhost.58638: Flags [.], ack 1486, win 2730, length 0
15:34:46.290796 IP localhost.ssh > localhost.58638: Flags [P.], seq 1382:1426, ack 1486, win 2730, length 44
15:34:46.290874 IP localhost.58638 > localhost.ssh: Flags [P.], seq 1486:1546, ack 1426, win 744, length 60
15:34:46.291492 IP localhost.ssh > localhost.58638: Flags [P.], seq 1426:1478, ack 1546, win 2730, length 52
15:34:46.293381 IP localhost.58638 > localhost.ssh: Flags [P.], seq 1546:1630, ack 1478, win 744, length 84
15:34:46.295301 IP localhost.ssh > localhost.58638: Flags [P.], seq 1478:1530, ack 1630, win 2730, length 52
15:34:46.297336 IP localhost.58638 > localhost.ssh: Flags [P.], seq 1630:1714, ack 1530, win 744, length 84
15:34:46.297679 IP localhost.ssh > localhost.58638: Flags [P.], seq 1530:1582, ack 1714, win 2730, length 52
15:34:46.299387 IP localhost.58638 > localhost.ssh: Flags [P.], seq 1714:1798, ack 1582, win 744, length 84
15:34:46.299671 IP localhost.ssh > localhost.58638: Flags [P.], seq 1582:1634, ack 1798, win 2730, length 52
15:34:46.300404 IP localhost.58638 > localhost.ssh: Flags [F.], seq 1798, ack 1634, win 744, length 0
15:34:46.302951 IP localhost.ssh > localhost.58638: Flags [F.], seq 1634, ack 1799, win 2730, length 0
15:34:46.302978 IP localhost.58638 > localhost.ssh: Flags [.], ack 1635, win 744, length 0
15:34:46.731429 IP localhost.52137 > localhost.epmd: Flags [S], seq 730693154, win 43690, options [mss 65495,nop,nop,sackOK,nop,wscale 6], length 0
15:34:46.731453 IP localhost.epmd > localhost.52137: Flags [S.], seq 2470608525, ack 730693155, win 43690, options [mss 65495,nop,nop,sackOK,nop,wscale 6], length 0
15:34:46.731476 IP localhost.52137 > localhost.epmd: Flags [.], ack 1, win 683, length 0
15:34:46.731555 IP localhost.52137 > localhost.epmd: Flags [P.], seq 1:22, ack 1, win 683, length 21
15:34:46.731565 IP localhost.epmd > localhost.52137: Flags [.], ack 22, win 683, length 0
15:34:46.731672 IP localhost.epmd > localhost.52137: Flags [P.], seq 1:3, ack 22, win 683, length 2
15:34:46.731689 IP localhost.52137 > localhost.epmd: Flags [.], ack 3, win 683, length 0
15:34:46.731713 IP localhost.epmd > localhost.52137: Flags [F.], seq 3, ack 22, win 683, length 0
15:34:46.731768 IP localhost.52137 > localhost.epmd: Flags [F.], seq 22, ack 4, win 683, length 0
15:34:46.731788 IP localhost.epmd > localhost.52137: Flags [.], ack 23, win 683, length 0
15:34:47.234066 IP localhost.48301 > localhost.epmd: Flags [S], seq 823412417, win 43690, options [mss 65495,nop,nop,sackOK,nop,wscale 6], length 0
15:34:47.234098 IP localhost.epmd > localhost.48301: Flags [S.], seq 1809124976, ack 823412418, win 43690, options [mss 65495,nop,nop,sackOK,nop,wscale 6], length 0

...
```

If you could help me, I'd really appreciate.

Thank you

**Comment by deadc0de6** [comment]
Hello,

It seems scannerl is unable to connect to `localhost` in your example. I tried it and it looks like it doesn't like the keyword `localhost` on my machine either (don't know why though). 

I tried with another hostname, by adding an entry in `/etc/hosts`, for example `127.0.1.1 somename` and it works when issuing `./scannerl -v 255 -m httpbg -d google.com -s somename`. Also when using multiple times your own host: `./scannerl -v 255 -m httpbg -d target1,target2,target3 -s somename,somename,somename`

Make sure you are able to ssh on the hostname you defined using `ssh somename`.
Also make sure that no old attempts are still running, as when scannerl fails, erlang binary is sometimes still running in the background. You can check this with `ps aux | grep -i 'erl\|beam.smp'` and kill the pid matching the failed running erlang binary with `kill -9 <pid>`. 

`ps aux` of a failed attempt looks something like this:
```
user    14888  0.0  0.2 3551656 19832 ?       Sl   16:59   0:00 /usr/lib/erlang/erts-9.2/bin/beam.smp -K true -- -root /usr/lib/erlang -progname erl -- -home /home/user -- -sname 1517846371-slave-0 -hidden -smp enable -P 134217727 -connect_all false -kernel dist_nodelay false -kernel inet_dist_listen_min 11100 -noshell -noinput -noshell -noinput
```

BTW you shouldn't have to use `sudo` with scannerl.

Hope this helps, let me know

**Comment by papafil** [comment]
Thank you very much for your fast answer.
I have been trying using it locally, with "somename", I am still getting the same issue, complaining about "ping failed". Then I tried remotely, with 2 VPS, trying to each others. So the master connects to the slave, spawns erl (on the slave):
` /usr/lib/erlang/erts-7.3/bin/beam.smp -K true -- -root /usr/lib/erlang -progname erl -- -home /root -- -sname 1517911934-slave-0 -hidden -smp enable -P 134217727 -connect_all false -kernel dist_nodelay false -kernel inet_dist_listen_min 11100 -noshell -noinput -noshell -noinput
`

But then, it is still complaining about not being able to ping the machine, even though the ports are open and the machine is reachable (no iptables, no fw and netstat reports opened ports). When pinging, there is nothing coming out of the (master) machine. To me, looks like an erlang issue. I'm looking in that direction right now. If you've any clue...

Thanks a lot !

**Comment by deadc0de6** [comment]
This is weird. `ping failed` is a typical connectivity issue between the master and the node(s) (be it local or remote). You should focus on making it work on your host first (standalone). 

Does `ssh somename` from your host work ? 

When running scannerl with `-v 255`, a debug line containing `[uslave] remote command:` is outputed that contains an SSH onliner, is this running successfully on itself ? Yours from the above output was this:
```
ssh -q -o UserKnownHostsFile=/dev/null -o StrictHostKeyChecking=no localhost erl -sname 1517840344-slave-0 -hidden +K true -smp enable -P 134217727 -connect_all false -kernel dist_nodelay false -kernel inet_dist_listen_min 11100 -detached -noinput
```

Here are a few checks that you can try:
* make sure you are able to ssh to the hostname(s) you provide to scannerl (exact same hostname, same username, ...) - and that SSH auth is done using keys.
* if you can, try to upgrade you erlang version (latest version is available through https://www.erlang-solutions.com/resources/download.html) and re-compile scannerl with it.
* make sure you are using the same erlang security cookie on all hosts involved (content of the file `$HOME/.erlang.cookie`).

Hope this helps ...

**Comment by deadc0de6** [comment]
I digged a bit and was able to reproduce your issue when using localhost (or some other defined hostname pointing to it in `/etc/hosts`) on a different hosts. I don't know however why this happens on some setups and not on others (dns settings maybe ?). 

For the little story, when using localhost as a slave, it seems erlang doesn't like the `-sname` argument which is passed to the `erl` binary when starting a slave node (http://erlang.org/doc/man/erl.html), and cannot connect to the slaves. I changed it to the fully qualified node name (`-name`) and it seems to work. 

I haven't tested it on a setup with remote hosts yet but can you give it a try on your localhost ?
It is in the branch [localhost_issue](https://github.com/kudelskisecurity/scannerl/tree/localhost_issue).

However if you use your hostname (the one returned by the shell command `hostname`), this should work even on the master branch version. For example:
```
./scannerl -v 255 -m httpbg -d target1,target2,target3 -s `hostname`,`hostname`,`hostname`
```

While testing, make also sure no failed attempts are running. If any, you can kill them with `sudo killall beam.smp`. The reason those failed attempts stay around is that the master node is asynchronously starting the slaves using an ssh command (that's the one you see with debugs on the line `[uslave] remote command:`) and thus is not able to kill it if it cannot connect to the slave.

If it works for you and it is a viable solution for remote hosts too, I'll merge it in master.

**Comment by papafil** [comment]
Thanks a lot for your support. I'm not able to make it work, I have to investigate. Not able to ping, even localhost. No fw, fresh Ubuntu 16.04.3 install, even tough I define a different hostname. SSH is able to spawn the service, but fail to ping. Now I'm playing manually, so I can get how this erlang works. Thank you.

**Comment by papafil** [comment]
This one seems to be fixing the issue:

```
diff --git a/src/utils/utils_slave.erl b/src/utils/utils_slave.erl
index 82ea6f5..3f04a0c 100644
--- a/src/utils/utils_slave.erl
+++ b/src/utils/utils_slave.erl
@@ -117,7 +117,7 @@ wait_for_it(Node, Port, Ref, Dbg) ->
 
 % start a remote node
 start_it(Node, Hostname, Name, Portmin, Timeout, Dbg) ->
-  Cmd = string:join([?REMOTE_BIN, Hostname, ?BIN, "-sname", Name,
+  Cmd = string:join([?REMOTE_BIN, Hostname, ?BIN, "-sname", lists:concat([Name, "@", Hostname]),
     ?ARGS, ?TCPPORT, integer_to_list(Portmin), ?CONNARGS], " "),
   utils:debug(master, io_lib:fwrite("[uslave] remote command: ~p", [Cmd]),
     undefined, Dbg),

```

**Comment by deadc0de6** [comment]
Interesting, thank you.
I'll update the *localhost_issue* with your fix and will merge into master it as soon as I'll be able to test it successfully with remotes.

**Comment by deadc0de6** [comment]
I've patched scannerl in the *localhost_issue* branch and added more debugs and error catching for ssh to help in the debugging process
```
unable to start host "somenam" (name:"1518545146-slave-0"): "SSH error code: 255"
```
and 
```
[uslave] ssh command succeeded
```

this will help to distinguish between pure ssh connection issues and erlang distributed specific issues.

**Comment by deadc0de6** [comment]
This was successfully tested with remotes and has been merged in master. A new version (v0.38: https://github.com/kudelskisecurity/scannerl/releases/tag/v0.38) has been released.

Thanks again for your help!
